{"$schema":"https://json-schema.org/draft/2020-12/schema","additionalProperties":false,"properties":{"accepted_compatibility_state":{"const":"COMPATIBLE_WITH_ACCEPTED_SPECIFICATION"},"authority_id":{"minLength":1,"type":"string"},"authority_type":{"const":"operational_package_interface"},"authorization_boundaries":{"items":{"minLength":1,"type":"string"},"minItems":1,"type":"array","uniqueItems":true},"capture_package_obligations":{"items":{"minLength":1,"type":"string"},"minItems":1,"type":"array","uniqueItems":true},"compatibility_declaration_schema_role":{"const":"compatibility_declaration_schema"},"interface_version":{"minLength":1,"type":"string"},"manifest_schema_role":{"const":"future_package_manifest_schema"},"required_authority_roles":{"items":{"minLength":1,"type":"string"},"minItems":1,"type":"array","uniqueItems":true},"required_schema_roles":{"items":{"minLength":1,"type":"string"},"minItems":1,"type":"array","uniqueItems":true},"review_issuance_authority":{"minLength":1,"type":"string"},"review_receipt_schema_role":{"const":"future_review_receipt_schema"},"schema_version":{"const":"6.0.0-DRAFT"},"terminal_review_decision":{"const":"INDEPENDENTLY_ACCEPTED"},"trusted_reviewers":{"items":{"minLength":1,"type":"string"},"minItems":1,"type":"array","uniqueItems":true}},"required":["accepted_compatibility_state","authority_id","authority_type","authorization_boundaries","capture_package_obligations","compatibility_declaration_schema_role","interface_version","manifest_schema_role","required_authority_roles","required_schema_roles","review_issuance_authority","review_receipt_schema_role","schema_version","terminal_review_decision","trusted_reviewers"],"title":"R4 future interface policy","type":"object"}
