{"accepted_compatibility_state":"COMPATIBLE_WITH_ACCEPTED_SPECIFICATION","authority_id":"RANDLE-R4-OPERATIONAL-INTERFACE-1","authority_type":"operational_package_interface","authorization_boundaries":["BASELINE_CAPTURE_WITHHELD","DEPLOYMENT_WITHHELD","TRADING_WITHHELD"],"capture_package_obligations":["PRIMARY_STREAM_AUTHORITY","IMMUTABLE_MANIFEST","INDEPENDENT_REVIEW","SEPARATE_CAPTURE_AUTHORIZATION"],"compatibility_declaration_schema_role":"compatibility_declaration_schema","interface_version":"RANDLE-OPERATIONAL-PACKAGE-INTERFACE-3","manifest_schema_role":"future_package_manifest_schema","required_authority_roles":["attempt_authorization","timestamp_authority","observer_source_authority","comparison_authority"],"required_schema_roles":["future_package_manifest_schema","future_review_receipt_schema","compatibility_declaration_schema"],"review_issuance_authority":"RANDLE-R4-FUTURE-REVIEW-ISSUER-1","review_receipt_schema_role":"future_review_receipt_schema","schema_version":"6.0.0-DRAFT","terminal_review_decision":"INDEPENDENTLY_ACCEPTED","trusted_reviewers":["RANDLE-R4-INDEPENDENT-REVIEWER-1"]}
